<?xml version="1.0" encoding="UTF-8" ?>
<schema xmlns="http://www.w3.org/2001/XMLSchema"
        targetNamespace="http://www.example.org/02"
        xmlns:tns="http://www.example.org/02"
        elementFormDefault="qualified">
    <element name="books">
        <complexType>
            <sequence minOccurs="1" maxOccurs="unbounded">
                <element name="book">
                    <complexType>
                        <sequence>
                            <element name="title" type="string"/>
                            <element name="content" type="string"/>
                            <choice>
                                <element name="author" type="string"/>
                                <!--复杂类型-->
                                <element name="authors">
                                    <complexType>
                                        <sequence minOccurs="1" maxOccurs="unbounded">
                                            <element name="author" type="string"></element>
                                        </sequence>
                                    </complexType>
                                </element>
                            </choice>
                            <element name="price" type="double"/>
                        </sequence>
                        <attribute name="id" type="int" use="required"/>
                    </complexType>
                </element>
            </sequence>
        </complexType>
    </element>
</schema>